[
  {
    "model": "DJI Mavic 3 Enterprise",
    "source_listing_labels": "DJI Mavic 3 Enterprise",
    "source_row_count": 1,
    "configurations_tracked": 1,
    "listed_price_low_usd": 16950.0,
    "listed_price_high_usd": 16950.0,
    "median_listed_price_usd": 16950.0,
    "snapshot_date": "2026-07-07",
    "release_quarter": "2026-Q3",
    "observation_unit": "aircraft model-level aggregate",
    "quality_status": "passed_publication_gate",
    "source_url": "https://reboot-hub.com/pages/reboot-hub-data",
    "methodology_note": "Aircraft model-level aggregate of published Reboot Hub catalog configuration prices on the snapshot date. Values are listed prices, not inventory claims or completed-sale prices.",
    "non_affiliation_note": "Reboot Hub is not affiliated with, endorsed by, or officially authorized by DJI."
  },
  {
    "model": "DJI Mavic 3 Thermal",
    "source_listing_labels": "DJI Mavic 3 Thermal",
    "source_row_count": 1,
    "configurations_tracked": 1,
    "listed_price_low_usd": 16947.0,
    "listed_price_high_usd": 16947.0,
    "median_listed_price_usd": 16947.0,
    "snapshot_date": "2026-07-07",
    "release_quarter": "2026-Q3",
    "observation_unit": "aircraft model-level aggregate",
    "quality_status": "passed_publication_gate",
    "source_url": "https://reboot-hub.com/pages/reboot-hub-data",
    "methodology_note": "Aircraft model-level aggregate of published Reboot Hub catalog configuration prices on the snapshot date. Values are listed prices, not inventory claims or completed-sale prices.",
    "non_affiliation_note": "Reboot Hub is not affiliated with, endorsed by, or officially authorized by DJI."
  },
  {
    "model": "DJI Inspire 3",
    "source_listing_labels": "DJI Inspire 3",
    "source_row_count": 1,
    "configurations_tracked": 4,
    "listed_price_low_usd": 13358.0,
    "listed_price_high_usd": 20001.0,
    "median_listed_price_usd": 16603.0,
    "snapshot_date": "2026-07-07",
    "release_quarter": "2026-Q3",
    "observation_unit": "aircraft model-level aggregate",
    "quality_status": "passed_publication_gate",
    "source_url": "https://reboot-hub.com/pages/reboot-hub-data",
    "methodology_note": "Aircraft model-level aggregate of published Reboot Hub catalog configuration prices on the snapshot date. Values are listed prices, not inventory claims or completed-sale prices.",
    "non_affiliation_note": "Reboot Hub is not affiliated with, endorsed by, or officially authorized by DJI."
  },
  {
    "model": "DJI Matrice 4T",
    "source_listing_labels": "DJI Matrice 4T | DJI Matrice 4T (Customization)",
    "source_row_count": 2,
    "configurations_tracked": 2,
    "listed_price_low_usd": 13500.0,
    "listed_price_high_usd": 13500.0,
    "median_listed_price_usd": 13500.0,
    "snapshot_date": "2026-07-07",
    "release_quarter": "2026-Q3",
    "observation_unit": "aircraft model-level aggregate",
    "quality_status": "passed_publication_gate",
    "source_url": "https://reboot-hub.com/pages/reboot-hub-data",
    "methodology_note": "Aircraft model-level aggregate of published Reboot Hub catalog configuration prices on the snapshot date. Values are listed prices, not inventory claims or completed-sale prices.",
    "non_affiliation_note": "Reboot Hub is not affiliated with, endorsed by, or officially authorized by DJI."
  },
  {
    "model": "DJI Matrice 30T",
    "source_listing_labels": "DJI Matrice 30T",
    "source_row_count": 1,
    "configurations_tracked": 1,
    "listed_price_low_usd": 12213.0,
    "listed_price_high_usd": 12213.0,
    "median_listed_price_usd": 12213.0,
    "snapshot_date": "2026-07-07",
    "release_quarter": "2026-Q3",
    "observation_unit": "aircraft model-level aggregate",
    "quality_status": "passed_publication_gate",
    "source_url": "https://reboot-hub.com/pages/reboot-hub-data",
    "methodology_note": "Aircraft model-level aggregate of published Reboot Hub catalog configuration prices on the snapshot date. Values are listed prices, not inventory claims or completed-sale prices.",
    "non_affiliation_note": "Reboot Hub is not affiliated with, endorsed by, or officially authorized by DJI."
  },
  {
    "model": "DJI Mavic 2 Enterprise",
    "source_listing_labels": "DJI Mavic 2 Enterprise",
    "source_row_count": 1,
    "configurations_tracked": 1,
    "listed_price_low_usd": 3298.0,
    "listed_price_high_usd": 3298.0,
    "median_listed_price_usd": 3298.0,
    "snapshot_date": "2026-07-07",
    "release_quarter": "2026-Q3",
    "observation_unit": "aircraft model-level aggregate",
    "quality_status": "passed_publication_gate",
    "source_url": "https://reboot-hub.com/pages/reboot-hub-data",
    "methodology_note": "Aircraft model-level aggregate of published Reboot Hub catalog configuration prices on the snapshot date. Values are listed prices, not inventory claims or completed-sale prices.",
    "non_affiliation_note": "Reboot Hub is not affiliated with, endorsed by, or officially authorized by DJI."
  },
  {
    "model": "DJI Mavic 3 Pro Cine",
    "source_listing_labels": "DJI Mavic 3 Pro Cine",
    "source_row_count": 1,
    "configurations_tracked": 8,
    "listed_price_low_usd": 2800.0,
    "listed_price_high_usd": 3936.0,
    "median_listed_price_usd": 3271.0,
    "snapshot_date": "2026-07-07",
    "release_quarter": "2026-Q3",
    "observation_unit": "aircraft model-level aggregate",
    "quality_status": "passed_publication_gate",
    "source_url": "https://reboot-hub.com/pages/reboot-hub-data",
    "methodology_note": "Aircraft model-level aggregate of published Reboot Hub catalog configuration prices on the snapshot date. Values are listed prices, not inventory claims or completed-sale prices.",
    "non_affiliation_note": "Reboot Hub is not affiliated with, endorsed by, or officially authorized by DJI."
  },
  {
    "model": "DJI Mavic 4 Pro",
    "source_listing_labels": "DJI Mavic 4 Pro",
    "source_row_count": 1,
    "configurations_tracked": 8,
    "listed_price_low_usd": 2280.0,
    "listed_price_high_usd": 3301.0,
    "median_listed_price_usd": 2840.0,
    "snapshot_date": "2026-07-07",
    "release_quarter": "2026-Q3",
    "observation_unit": "aircraft model-level aggregate",
    "quality_status": "passed_publication_gate",
    "source_url": "https://reboot-hub.com/pages/reboot-hub-data",
    "methodology_note": "Aircraft model-level aggregate of published Reboot Hub catalog configuration prices on the snapshot date. Values are listed prices, not inventory claims or completed-sale prices.",
    "non_affiliation_note": "Reboot Hub is not affiliated with, endorsed by, or officially authorized by DJI."
  },
  {
    "model": "DJI Mavic 3 Pro",
    "source_listing_labels": "DJI Mavic 3 Pro",
    "source_row_count": 1,
    "configurations_tracked": 10,
    "listed_price_low_usd": 1712.0,
    "listed_price_high_usd": 3354.0,
    "median_listed_price_usd": 2486.0,
    "snapshot_date": "2026-07-07",
    "release_quarter": "2026-Q3",
    "observation_unit": "aircraft model-level aggregate",
    "quality_status": "passed_publication_gate",
    "source_url": "https://reboot-hub.com/pages/reboot-hub-data",
    "methodology_note": "Aircraft model-level aggregate of published Reboot Hub catalog configuration prices on the snapshot date. Values are listed prices, not inventory claims or completed-sale prices.",
    "non_affiliation_note": "Reboot Hub is not affiliated with, endorsed by, or officially authorized by DJI."
  },
  {
    "model": "DJI Mavic 3 Classic",
    "source_listing_labels": "DJI Mavic 3 Classic",
    "source_row_count": 1,
    "configurations_tracked": 10,
    "listed_price_low_usd": 2140.0,
    "listed_price_high_usd": 2721.0,
    "median_listed_price_usd": 2450.0,
    "snapshot_date": "2026-07-07",
    "release_quarter": "2026-Q3",
    "observation_unit": "aircraft model-level aggregate",
    "quality_status": "passed_publication_gate",
    "source_url": "https://reboot-hub.com/pages/reboot-hub-data",
    "methodology_note": "Aircraft model-level aggregate of published Reboot Hub catalog configuration prices on the snapshot date. Values are listed prices, not inventory claims or completed-sale prices.",
    "non_affiliation_note": "Reboot Hub is not affiliated with, endorsed by, or officially authorized by DJI."
  },
  {
    "model": "DJI Mavic 3",
    "source_listing_labels": "DJI Mavic 3",
    "source_row_count": 1,
    "configurations_tracked": 10,
    "listed_price_low_usd": 1481.0,
    "listed_price_high_usd": 2601.0,
    "median_listed_price_usd": 1953.0,
    "snapshot_date": "2026-07-07",
    "release_quarter": "2026-Q3",
    "observation_unit": "aircraft model-level aggregate",
    "quality_status": "passed_publication_gate",
    "source_url": "https://reboot-hub.com/pages/reboot-hub-data",
    "methodology_note": "Aircraft model-level aggregate of published Reboot Hub catalog configuration prices on the snapshot date. Values are listed prices, not inventory claims or completed-sale prices.",
    "non_affiliation_note": "Reboot Hub is not affiliated with, endorsed by, or officially authorized by DJI."
  },
  {
    "model": "DJI Mavic 3 Cine",
    "source_listing_labels": "DJI Mavic 3 Cine",
    "source_row_count": 1,
    "configurations_tracked": 8,
    "listed_price_low_usd": 1496.0,
    "listed_price_high_usd": 2751.0,
    "median_listed_price_usd": 1916.0,
    "snapshot_date": "2026-07-07",
    "release_quarter": "2026-Q3",
    "observation_unit": "aircraft model-level aggregate",
    "quality_status": "passed_publication_gate",
    "source_url": "https://reboot-hub.com/pages/reboot-hub-data",
    "methodology_note": "Aircraft model-level aggregate of published Reboot Hub catalog configuration prices on the snapshot date. Values are listed prices, not inventory claims or completed-sale prices.",
    "non_affiliation_note": "Reboot Hub is not affiliated with, endorsed by, or officially authorized by DJI."
  },
  {
    "model": "DJI Inspire 1 V2.0",